<?xml version="1.0" encoding="UTF-8"?>
<?xml-stylesheet type="text/xsl" href="emp.xsl"?>
<Company xmlns:xsi="http://www.w3.org/2001/XMLSchema-instance" xsi:noNamespaceSchemaLocation="emp.xsd">
	<Employee EMPID="Emp00">
		<Emp-name>Adriel Luis Gomes</Emp-name>
		<Emp-age>56</Emp-age>
		<Emp-salary>55000</Emp-salary>
		<Emp-emailid>adre@gmail.com</Emp-emailid>
		<Emp-Phonenum>9099123932</Emp-Phonenum>
		<Emp-designation>CEO</Emp-designation>
	</Employee>
	<Employee EMPID="Emp01">
		<Emp-name>Sumi Thomas</Emp-name>
		<Emp-age>27</Emp-age>
		<Emp-salary>77000</Emp-salary>
		<Emp-emailid>samieboi@gmail.com</Emp-emailid>
		<Emp-Phonenum>7989139645</Emp-Phonenum>
		<Emp-designation>Junior Developer</Emp-designation>
	</Employee>
	<Employee EMPID="Emp02">
		<Emp-name>Adity Raghavan</Emp-name>
		<Emp-age>43</Emp-age>
		<Emp-salary>100000</Emp-salary>
		<Emp-emailid>adi123@gmail.com</Emp-emailid>
		<Emp-Phonenum>9822123214</Emp-Phonenum>
		<Emp-designation>Software Engineer</Emp-designation>
	</Employee>
	<Employee EMPID="Emp03">
		<Emp-name>Delwin Thomas</Emp-name>
		<Emp-age>34</Emp-age>
		<Emp-salary>70000</Emp-salary>
		<Emp-emailid>dlthomas@gmail.com</Emp-emailid>
		<Emp-Phonenum>9791239225</Emp-Phonenum>
		<Emp-designation>Senior Developer</Emp-designation>
	</Employee>
</Company>